{"schema":"nrm.customer.provider_hello.v1","messageId":"hello-001","timestamp":"2026-08-13T10:00:00+08:00","source":"CUSTOMER","data":{"providerId":"customer-afsim-link-adapter","softwareVersion":"1.0.0","supportedSchemas":["nrm.customer.resource_report.v1","nrm.customer.navigation_report.v1"],"supportedNetworkTypes":["LINK11","LINK16"]}}
